OMEGAWIKI	SEEALSO	GLOSS	SEMANTICFIELD	DEFINITION	POS	WOLD	SWADESH1952	IELEX	TOB110	LeipzigJakarta100	ABVD	CALMSEA200
3962	-	VERMIN	Animals	Small animals and insects that can be harmful and which are difficult to control when they appear in large numbers. (Source: CAMB)	Noun	-	-	-	-	-	-	-
3968	687459	VILLAGE	Social and political relations	A group of houses and other buildings, such as a church, a school and some shops, which is smaller than a town, usually in the countryside.	Noun	19.16	-	-	-	-	-	-
5617	-	VOMIT	The body	To regurgitate the contents of the stomach.	Verb	4.57	-	to vomit	-	-	to vomit	vomit
6557	6558	WAKE UP	The body	To stop sleeping.	Verb	4.63	-	-	-	-	-	-
6054	-	WALK	Motion	To move from one place to another by moving legs alternately, so that at least one foot is in contact with the floor or surface at any one time.	Verb	10.45	-	to walk	walk(go)	-	to walk	-
5485	-	WARM	Sense perception	Having a temperature slightly higher than usual, still pleasant.	Adjective	15.851	-	warm (as in weather)	warm	-	warm	warm
6069	-	WASH	Basic actions and technology	To remove dirt and grime from an object, using water (usually with soap).	Verb	9.36	-	to wash	-	-	-	wash
4118	-	WATER	The physical world	Common liquid (H₂O) which forms rain, rivers, the sea, etc., and which makes up a large part of the bodies of organisms.	Noun	1.31	-	water	water	water	water	water
5455	-	WE	Kinship	The speaker or writer and at least one other person.	Function word	2.94	-	we	we	-	we	-
1280854	-	WEAVE	Clothing and grooming	To make, as fabric, by enterlacing threads.	Verb	6.33	-	-	-	-	-	-
7027	-	WET	Sense perception	Covered with or impregnated with liquid.	Adjective	15.83	-	wet	-	-	wet	-
5491	-	WHAT	Cognition	Which thing.	Function word	17.64	-	what	what	what?	what?	-
5493	-	WHEN	Cognition	at what time	Function word	17.65	-	when	-	-	when?	-
5492	-	WHERE	Cognition	At what place?	Function word	17.66	-	where	-	-	where?	-
5825	5872	WHITE	Sense perception	Bright and colourless; reflecting equal quantities of all frequencies of visible light.	Adjective	15.64	-	white	white	-	white	white
5490	-	WHO	Cognition	What person or people; which person or people.	Function word	17.68	-	who	who	who?	who?	-
5502	-	WIDE	Spatial relations	Having a long distance or area between two points, especially horizontally.	Adjective	12.61	-	wide	-	wide	wide	-
5429	-	WIFE	Kinship	A married woman.	Noun	2.32	-	wife	-	-	wife	-
4160	-	WIND	The physical world	The motion of air relative to the earth's surface; usually means horizontal air motion, as distinguished from vertical motion.	Noun	1.72	-	wind (as in breeze)	wind	wind	wind	wind
5528	-	WING	The body	The appendage of an animal's (bird, bat, insect) body that enables it to fly in the air.	Noun	4.392	-	wing	-	wing	wing	wing
6070	-	WIPE	Basic actions and technology	To move an object or utensil over a surface or other object while maintaining contact, in order that a substance be removed from its surface.	Verb	9.311	-	to wipe	-	-	-	-
5844	7435;5845;5843	WITH	Miscellaneous function words	In the company of	Function word	24.04	-	with (accompanying)	-	-	-	-
4165	-	WOMAN	Kinship	An adult human member of the sex that produces ova and bears young.	Noun	2.22	-	woman	woman	-	woman/female	-
741520	-	WOOD	The physical world	The substance making up the central part of the trunk and branches of a tree. Used as a material for construction, to manufacture various items, etc. or as fuel.	Noun	1.43	-	-	-	-	stick/wood	tree/wood
4168	-	WOODS	The physical world	A dense growth of trees more extensive than a grove and smaller than a forest.	Noun	1.41	-	-	-	-	woods/forest	-
471303	1507122	WORK, ACTIVITY	Basic actions and technology	To do a specific task by employing physical or mental powers.	Verb	-	-	-	-	-	-	-
5466	-	WORM	Animals	A generally tubular invertebrate of the annelid phylum.	Noun	3.84	-	worm	worm	-	worm (earthworm)	-
441371	-	YAWN	The body	To open the mouth widely and take a long, deep breath because of tiredness or boredom.	Verb	4.52	-	-	-	-	-	-
5478	5605	YEAR	Time	The time it takes the Earth to complete one revolution of the Sun (between 365.24 and 365.26 days depending on the point of reference).	Noun	14.73	-	year	year	-	year	year
6031	-	YELLOW	Sense perception	Having the colour of a yolk, a lemon or gold.	Adjective	15.69	-	yellow	yellow	-	yellow	-
525186	5603	YESTERDAY	Time	The day before today.	Function word	14.49	-	-	-	-	-	-
5456	-	YOU	Kinship	The group of persons addressed.	Function word	2.95	-	-	-	-	you	-
6816	-	TRUE	Emotions and values	Concurring with a given set of facts.	Adjective	16.66	-	-	-	-	-	-
